{
  "schema_version": "1.0.0",
  "interface_version": "2.0",
  "competition_id": "agenthon2026-forecasting-dev",
  "team_id": "team-example-0001",
  "track": "forecasting",
  "phase": "dev",
  "category": "api",
  "image": {
    "registry": "docker.io",
    "repository": "team-example/qfb2-forecaster",
    "digest": "sha256:fe9dfedf678ebc67564c47c61478cff47e3c2ea96304efd5609a6fdbcd71b26a"
  },
  "image_access": "public",
  "models": [
    {
      "name": "example-api-model",
      "version": "example-model-20260401",
      "training_cutoff": "2026-01",
      "access": "api",
      "revision": "r1"
    }
  ],
  "license": "Apache-2.0",
  "descriptor_digest": "sha256:6008d987a277fcee82496990c72738e6a94cd49759102199f32fdd638043b6a6"
}
