{
  "schema_version": "1.0.0",
  "interface_version": "2.0",
  "competition_id": "agenthon2026-forecasting-final",
  "team_id": "team-example-0001",
  "track": "forecasting",
  "phase": "final",
  "category": "api",
  "image": {
    "registry": "docker.io",
    "repository": "team-example/qfb2-forecaster",
    "digest": "sha256:4bd33729d44f4dc44d2fabbfcf928d28503bc62fed86f68f3a5c354317f0ca02"
  },
  "image_access": "public",
  "models": [
    {
      "name": "example-api-model",
      "version": "example-model-20260401",
      "training_cutoff": "2026-01",
      "access": "api",
      "revision": "r1"
    }
  ],
  "license": "Apache-2.0",
  "descriptor_digest": "sha256:01e36425b7f7083f7c70275833aa5bcde74d2771f753d947f202df99cfcb7c0d"
}
